{
  "schema_version": "1.0.0",
  "result_type": "typed-evidence-trust",
  "repository_id": "joku-dev/governance-framework-demo-consumer",
  "evidence_type": "vulnerability_scan",
  "generated_at": "2026-07-15T16:33:38Z",
  "pipeline": {
    "pipeline_name": "DevSecOps Baseline",
    "pipeline_run_id": "29432884108",
    "pipeline_url": "https://github.com/joku-dev/governance-framework-demo-consumer/actions/runs/29432884108",
    "event": "push",
    "status": "success",
    "run_attempt": 1
  },
  "repository": {
    "branch": "main",
    "commit_id": "4ec2b2bd53560e010ebb1c078c4d3bd41b0bfcc6"
  },
  "source_artifact": {
    "name": "application-evidence",
    "artifact_id": "8350108455",
    "size_bytes": 13032,
    "archive_download_url": "https://api.github.com/repos/joku-dev/governance-framework-demo-consumer/actions/artifacts/8350108455/zip",
    "archive_sha256": null
  },
  "trust": {
    "model_id": "evidence-trust-model-v1",
    "capture_phase": "additive_capture",
    "effective_level": "integrity_verified",
    "assessment_status": "evaluated",
    "verifier": "central-evidence-trust-intake/v1",
    "verified_at": "2026-07-15T16:42:42Z",
    "checks": [
      {
        "id": "subject_identity_complete",
        "result": "pass",
        "evidence_refs": [
          "trust.capture.source",
          "trust.capture.subjects"
        ]
      },
      {
        "id": "content_digest_verified",
        "result": "pass",
        "evidence_refs": [
          "trust.capture.subjects.vulnerability_scan_report",
          "trust.capture.subjects.evaluated_artifact"
        ]
      },
      {
        "id": "producer_run_resolved",
        "result": "pass",
        "evidence_refs": [
          "trust.capture.source.run_id"
        ]
      },
      {
        "id": "commit_matches_run",
        "result": "pass",
        "evidence_refs": [
          "trust.capture.source.commit_id"
        ]
      },
      {
        "id": "artifact_belongs_to_run",
        "result": "pass",
        "evidence_refs": [
          "trust.capture.source.artifact_name"
        ]
      },
      {
        "id": "baseline_ref_resolved",
        "result": "not_evaluated",
        "evidence_refs": []
      },
      {
        "id": "freshness_evaluated",
        "result": "pass",
        "evidence_refs": [
          "trust.capture.produced_at",
          "trust.verified_at"
        ],
        "policy_id": "freshness-vulnerability-scan-24h",
        "policy_version": "0.1.0",
        "policy_status": "provisional",
        "produced_at": "2026-07-15T16:33:23Z",
        "evaluated_at": "2026-07-15T16:42:42Z",
        "maximum_age_seconds": 86400,
        "finding_effect": "report_only",
        "reason": "Evidence age 559s is within the provisional maximum 86400s.",
        "age_seconds": 559
      },
      {
        "id": "replay_key_unique",
        "result": "not_evaluated",
        "evidence_refs": []
      },
      {
        "id": "custody_recorded",
        "result": "not_evaluated",
        "evidence_refs": []
      },
      {
        "id": "attestation_signature_valid",
        "result": "not_evaluated",
        "evidence_refs": []
      },
      {
        "id": "attestation_issuer_trusted",
        "result": "not_evaluated",
        "evidence_refs": []
      },
      {
        "id": "attestation_subject_matches",
        "result": "not_evaluated",
        "evidence_refs": []
      }
    ],
    "capture": {
      "contract_id": "evidence-collector-contract",
      "contract_version": "0.1.0",
      "status": "collected",
      "enforcement": "report_only",
      "evidence_type": "vulnerability_scan",
      "governance_domain": "devsecops",
      "collector": {
        "id": "central-vulnerability-scan-collector",
        "version": "0.1.0"
      },
      "produced_at": "2026-07-15T16:33:23Z",
      "captured_at": "2026-07-15T16:33:25Z",
      "source": {
        "provider": "ci_artifact",
        "repository_id": "joku-dev/governance-framework-demo-consumer",
        "commit_id": "4ec2b2bd53560e010ebb1c078c4d3bd41b0bfcc6",
        "workflow_name": "DevSecOps Baseline",
        "run_id": "29432884108",
        "run_attempt": 1,
        "artifact_name": "application-evidence",
        "source_uri": "https://github.com/joku-dev/governance-framework-demo-consumer/actions/runs/29432884108"
      },
      "subjects": [
        {
          "id": "vulnerability_scan_report",
          "evidence_ref": "trust.capture.subjects.vulnerability_scan_report",
          "algorithm": "sha256",
          "digest": "4cece6e7ba2796b8b73c49608fff7a5bb9cea48ea897cb3d541faf5b98df3214",
          "size_bytes": 226
        },
        {
          "id": "evaluated_artifact",
          "evidence_ref": "trust.capture.subjects.evaluated_artifact",
          "algorithm": "sha256",
          "digest": "8606fc2b360957e150913ec3806f4f48f6dae6d05ed34dd6c9b1749d8b17a083",
          "size_bytes": 9309
        }
      ],
      "custody": [
        {
          "sequence": 1,
          "action": "download",
          "actor": "central-vulnerability-scan-collector",
          "at": "2026-07-15T16:33:25Z",
          "source_uri": "https://github.com/joku-dev/governance-framework-demo-consumer/actions/runs/29432884108",
          "output_refs": [
            "artifact_metadata"
          ]
        },
        {
          "sequence": 2,
          "action": "extract_and_hash",
          "actor": "central-vulnerability-scan-collector",
          "at": "2026-07-15T16:33:25Z",
          "source_uri": "https://github.com/joku-dev/governance-framework-demo-consumer/actions/runs/29432884108",
          "output_refs": [
            "trust.capture.subjects.vulnerability_scan_report",
            "trust.capture.subjects.evaluated_artifact"
          ]
        }
      ],
      "errors": [],
      "observations": {
        "scanner": {
          "name": "trivy",
          "version": "v0.70.0"
        },
        "finding_count": 0,
        "declared_max_severity": "none",
        "observed_max_severity": "none",
        "severity_consistent": true,
        "subject_binding": {
          "mode": "co_collected",
          "evaluated_subject": "application-source.tar.gz",
          "scan_declared_subject": "application-source.tar.gz",
          "scanner_attested": false
        }
      }
    }
  }
}
